ID_INICIATIVA,LEGISLATURA,EXTRACTO,F_CREACION,SITUACION,PROCEDIMIENTO,TIPO_FINALIZACION,TIPO_DESCRIPCION
"10L/PNLP-0552","10","Plan de acción específico para la población gitana.","2022-11-30","En tramitación","Ordinario","","PROPOSICIONES NO DE LEY EN PLENO"
"10L/PNLP-0553","10","Programación destinada a la audiencia infantil y juvenil canaria.","2022-12-02","Cerrada","Ordinario","Aprobada","PROPOSICIONES NO DE LEY EN PLENO"
"10L/PNLP-0554","10","Reducción del tipo impositivo del igic para los servicios prestados en el ámbito deportivo.","2022-12-02","Cerrada","Ordinario","Rechazada","PROPOSICIONES NO DE LEY EN PLENO"
"10L/PNLP-0555","10","La inmediata revisión, por la vía de urgencia, de la ley orgánica 10/2022, de 6 de septiembre.","2022-12-02","En tramitación","Ordinario","","PROPOSICIONES NO DE LEY EN PLENO"
"10L/PNLP-0545","10","Implantación y apertura de un consultorio local en la localidad de el cotillo.","2022-11-04","En tramitación","Ordinario","","PROPOSICIONES NO DE LEY EN PLENO"
"10L/PNLP-0538","10","El pacto de estado contra la violencia de género.","2022-10-25","Cerrada","Ordinario","Aprobada","PROPOSICIONES NO DE LEY EN PLENO"
"10L/PNLP-0546","10","Para solicitar al gobierno de españa la no revisión del delito de sedición.","2022-11-14","En tramitación","Ordinario","","PROPOSICIONES NO DE LEY EN PLENO"
"10L/PNLP-0532","10","Incentivos a la conectividad con la isla de la palma.","2022-10-10","Cerrada","Ordinario","Aprobada","PROPOSICIONES NO DE LEY EN PLENO"
"10L/PNLP-0533","10","Centro canario náutico pesquero de san cristóbal.","2022-10-10","Cerrada","Ordinario","Aprobada","PROPOSICIONES NO DE LEY EN PLENO"
"10L/PNLP-0550","10","Contra la violencia obstétrica a la mujer.","2022-11-28","Cerrada","Ordinario","Aprobada","PROPOSICIONES NO DE LEY EN PLENO"
"10L/PNLP-0551","10","Reconocimiento del puro canario como un producto artesanal de la región.","2022-11-28","Cerrada","Ordinario","Aprobada","PROPOSICIONES NO DE LEY EN PLENO"