ID_INICIATIVA,LEGISLATURA,EXTRACTO,F_CREACION,SITUACION,PROCEDIMIENTO,TIPO_FINALIZACION,TIPO_DESCRIPCION
"10L/PNLP-0437","10","Deflactar la tarifa del impuesto sobre la renta de las personas físicas (irpf).","2022-02-16","Cerrada","Ordinario","Rechazada","PROPOSICIONES NO DE LEY EN PLENO"
"10L/PNLP-0439","10","Modificación de la ley 20/1991 para la devolución del igic a las empresas afectadas por la quiebra de thomas cook.","2022-02-21","Cerrada","Ordinario","Aprobada","PROPOSICIONES NO DE LEY EN PLENO"
"10L/PNLP-0426","10","Muestras de odio contra el colectivo lgtbi.","2022-01-28","Cerrada","Ordinario","Aprobada","PROPOSICIONES NO DE LEY EN PLENO"
"10L/PNLP-0419","10","Defensa de la autonomía financiera y tributaria de canarias.","2022-01-14","En tramitación","Ordinario","","PROPOSICIONES NO DE LEY EN PLENO"
"10L/PNLP-0442","10","Impulso al acuerdo de fecha veintitrés de abril de dos mil veintiuno entre la administración de la comunidad autónoma y el comité de huelga para acabar con el abuso de la temporalidad en el sector de la administración general de la comunidad autónoma y fortalecer los servicios públicos.","2022-02-25","Cerrada","Ordinario","Rechazada","PROPOSICIONES NO DE LEY EN PLENO"
"10L/PNLP-0443","10","Creación de la dirección general de pesca recreativa.","2022-02-25","Cerrada","Ordinario","Retirada","PROPOSICIONES NO DE LEY EN PLENO"
"10L/PNLP-0444","10","Contra la trata, la explotación sexual y por la abolición de la prostitución.","2022-02-25","Cerrada","Ordinario","Aprobada","PROPOSICIONES NO DE LEY EN PLENO"
"10L/PNLP-0445","10","Creación de una lista específica de docentes especialistas titulados en el grado de seguridad y control de riesgos, e inclusión de dicha titulación como habilitada para el acceso a las actuales listas 308 (formación y orientación laboral).","2022-02-25","Cerrada","Ordinario","Aprobada","PROPOSICIONES NO DE LEY EN PLENO"
"10L/PNLP-0422","10","La obesidad.","2022-01-25","Cerrada","Ordinario","Aprobada","PROPOSICIONES NO DE LEY EN PLENO"
"10L/PNLP-0450","10","Medidas para el sector ganadero.","2022-03-14","Cerrada","Ordinario","Aprobada","PROPOSICIONES NO DE LEY EN PLENO"
"10L/PNLP-0414","10","Cese del ministro de consumo por sus ataques a la ganadería y al sector cárnico español.","2022-01-07","En tramitación","Ordinario","","PROPOSICIONES NO DE LEY EN PLENO"
"10L/PNLP-0416","10","Establecimiento de coeficientes reductores y anticipación de la edad de jubilación de los trabajadores de los servicios de salud.","2022-01-07","En tramitación","Ordinario","","PROPOSICIONES NO DE LEY EN PLENO"
"10L/PNLP-0427","10","Elaboración y aprobación de ley de coordinación de bomberas y bomberos públicos de los servicios de prevención, extinción de incendios y salvamento de canarias.","2022-01-31","Cerrada","Ordinario","Retirada","PROPOSICIONES NO DE LEY EN PLENO"
"10L/PNLP-0448","10","Ayudas a propietarios de viviendas vacacionales afectados por la erupción volcánica de la palma.","2022-03-07","Cerrada","Ordinario","Aprobada","PROPOSICIONES NO DE LEY EN PLENO"
"10L/PNLP-0428","10","Los costes del transporte y el precio de los insumos destinados a la alimentación animal.","2022-02-01","Cerrada","Ordinario","Aprobada","PROPOSICIONES NO DE LEY EN PLENO"
"10L/PNLP-0429","10","Inclusión del tren del sur de tenerife en la red ferroviaria de interés general.","2022-02-01","Cerrada","Ordinario","Retirada","PROPOSICIONES NO DE LEY EN PLENO"
"10L/PNLP-0430","10","Garantizar una práctica segura y legal del aborto basada en la salud y los derechos de las mujeres.","2022-02-07","Cerrada","Ordinario","Aprobada","PROPOSICIONES NO DE LEY EN PLENO"
"10L/PNLP-0431","10","Elaboración y aprobación de la ley de coordinación de bomberas y bomberos públicos de los servicios de prevención, extinción de incendios y salvamento de canarias.","2022-02-07","Cerrada","Ordinario","Aprobada","PROPOSICIONES NO DE LEY EN PLENO"
"10L/PNLP-0432","10","Inclusión del tren del sur de tenerife y el de gran canaria en la red ferroviaria de interés general.","2022-02-07","Cerrada","Ordinario","Aprobada","PROPOSICIONES NO DE LEY EN PLENO"
"10L/PNLP-0433","10","Campaña informativa y publicitaria en defensa de los servicios públicos de canarias.","2022-02-08","Cerrada","Ordinario","Aprobada","PROPOSICIONES NO DE LEY EN PLENO"
"10L/PNLP-0420","10","Medidas de prevención contra la obesidad e inclusión de la financiación de fármacos para tratar esta enfermedad en la cartera de servicios comunes del sistema nacional de salud.","2022-01-19","En tramitación","Ordinario","","PROPOSICIONES NO DE LEY EN PLENO"
"10L/PNLP-0421","10","Apoyo a la reforma laboral.","2022-01-21","En tramitación","Ordinario","","PROPOSICIONES NO DE LEY EN PLENO"
"10L/PNLP-0413","10","Restablecimiento del transporte sanitario urgente para cubrir las zonas afectadas por el volcán en la palma.","2022-01-07","Cerrada","Ordinario","Aprobada","PROPOSICIONES NO DE LEY EN PLENO"
"10L/PNLP-0415","10","Sistema de selección en las convocatorias para el cuerpo de profesores de música y artes escénicas.","2022-01-07","En tramitación","Ordinario","","PROPOSICIONES NO DE LEY EN PLENO"
"10L/PNLP-0423","10","Medidas extraordinarias y ayudas directas a todas las empresas, pymes y autónomos de la isla de la palma no afectados directamente por la erupción volcánica.","2022-01-25","En tramitación","Ordinario","","PROPOSICIONES NO DE LEY EN PLENO"
"10L/PNLP-0449","10","Condena invasión de ucrania.","2022-03-08","En tramitación","Ordinario","","PROPOSICIONES NO DE LEY EN PLENO"
"10L/PNLP-0451","10","Plena inclusión de los centros privados de educación infantil en la futura oferta pública de plazas de educación infantil de 0 a 3 años.","2022-03-22","En tramitación","Ordinario","","PROPOSICIONES NO DE LEY EN PLENO"
"10L/PNLP-0453","10","Modificación urgente del rea y ayudas a los ganaderos de canarias.","2022-03-28","Cerrada","Ordinario","Rechazada","PROPOSICIONES NO DE LEY EN PLENO"
"10L/PNLP-0438","10","Fiscalizar y controlar a través de un organismo de control público la sociedad de gestión de activos procedentes de la reestructuración bancaria (sareb) y así garantizar el derecho a la vivienda.","2022-02-18","Cerrada","Ordinario","Rechazada","PROPOSICIONES NO DE LEY EN PLENO"
"10L/PNLP-0462","10","Exención de la tributación en el impuesto de la renta sobre personas físicas (irpf) y/o en el impuesto de sociedades de las ayudas en el sector primario.","2022-04-28","Cerrada","Ordinario","Aprobada","PROPOSICIONES NO DE LEY EN PLENO"
"10L/PNLP-0463","10","La actividad de comercio triangular en la zec.","2022-04-29","Cerrada","Ordinario","","PROPOSICIONES NO DE LEY EN PLENO"
"10L/PNLP-0464","10","Los jóvenes extutelados.","2022-04-29","Cerrada","Ordinario","","PROPOSICIONES NO DE LEY EN PLENO"
"10L/PNLP-0465","10","Los jóvenes extutelados.","2022-04-29","Cerrada","Ordinario","Aprobada","PROPOSICIONES NO DE LEY EN PLENO"
"10L/PNLP-0454","10","Incremento de horas lectivas educación sobre economía.","2022-03-29","Cerrada","Ordinario","Rechazada","PROPOSICIONES NO DE LEY EN PLENO"
"10L/PNLP-0440","10","La transferencia del profesorado de infantil y primaria de religión.","2022-02-22","Cerrada","Ordinario","Aprobada","PROPOSICIONES NO DE LEY EN PLENO"
"10L/PNLP-0441","10","Deudas hipotecarias de las personas afectadas por la erupción del volcán de la palma.","2022-02-23","Cerrada","Ordinario","Aprobada","PROPOSICIONES NO DE LEY EN PLENO"
"10L/PNLP-0458","10","Mantenimiento de la asignatura historia y geografía de canarias como obligatoria en educación secundaria, y cumplimiento de la 10l/pnlp-0366.","2022-04-08","Cerrada","Ordinario","Aprobada","PROPOSICIONES NO DE LEY EN PLENO"
"10L/PNLP-0424","10","Reconocimiento de la labor de las trabajadoras de los servicios de atención domiciliaria.","2022-01-25","En tramitación","Ordinario","","PROPOSICIONES NO DE LEY EN PLENO"
"10L/PNLP-0425","10","Apoyo a la ganadería.","2022-01-25","Cerrada","Ordinario","Aprobada","PROPOSICIONES NO DE LEY EN PLENO"
"10L/PNLP-0456","10","La atención bucodental ajustada a las necesidades de las personas con discapacidad cognitiva.","2022-04-07","Cerrada","Ordinario","Aprobada","PROPOSICIONES NO DE LEY EN PLENO"
"10L/PNLP-0457","10","Ayudas económicas y subvenciones específicas para la revisión y mejora de los sistemas de ventilación de locales, edificios públicos y comerciales de canarias.","2022-04-07","Cerrada","Ordinario","Aprobada","PROPOSICIONES NO DE LEY EN PLENO"
"10L/PNLP-0452","10","Primeros auxilios a nivel educativo.","2022-03-24","Cerrada","Ordinario","Aprobada","PROPOSICIONES NO DE LEY EN PLENO"
"10L/PNLP-0435","10","Medidas para la temporada turística 2022.","2022-02-14","En tramitación","Ordinario","","PROPOSICIONES NO DE LEY EN PLENO"
"10L/PNLP-0436","10","Medidas urgentes para el turismo en canarias.","2022-02-15","En tramitación","Ordinario","","PROPOSICIONES NO DE LEY EN PLENO"
"10L/PNLP-0455","10","Para garantizar la protección de la persona que cuida.","2022-04-06","Cerrada","Ordinario","Aprobada","PROPOSICIONES NO DE LEY EN PLENO"
"10L/PNLP-0461","10","Refuerzo de la farmacia en la salud digital.","2022-04-26","Cerrada","Ordinario","Aprobada","PROPOSICIONES NO DE LEY EN PLENO"
"10L/PNLP-0459","10","Las viviendas de titularidad de la comunidad autónoma de canarias adjudicadas en régimen de alquiler.","2022-04-19","Cerrada","Ordinario","Rechazada","PROPOSICIONES NO DE LEY EN PLENO"
"10L/PNLP-0460","10","Creación del grado universitario en imagen médica y radioterapia.","2022-04-19","En tramitación","Ordinario","","PROPOSICIONES NO DE LEY EN PLENO"
"10L/PNLP-0417","10","Calidad del servicio, competencia y respeto a los derechos de los consumidores en las oficinas bancarias.","2022-01-11","Cerrada","Ordinario","Aprobada","PROPOSICIONES NO DE LEY EN PLENO"
"10L/PNLP-0418","10","Contratación de un servicio de transporte sanitario aéreo mediante helicóptero con soporte vital avanzado, con base en fuerteventura.","2022-01-11","Cerrada","Ordinario","","PROPOSICIONES NO DE LEY EN PLENO"
"10L/PNLP-0434","10","Declaración de procedimiento de emergencia en materia de contratación en la isla de la palma.","2022-02-10","Cerrada","Ordinario","Aprobada","PROPOSICIONES NO DE LEY EN PLENO"
"10L/PNLP-0446","10","Impulso y apoyo al sector aeronáutico y aeroespacial canario.","2022-03-07","Cerrada","Ordinario","Retirada","PROPOSICIONES NO DE LEY EN PLENO"
"10L/PNLP-0447","10","Centro de interpretación de la necrópolis de maspalomas en san bartolomé de tirajana.","2022-03-07","En tramitación","Ordinario","","PROPOSICIONES NO DE LEY EN PLENO"
"10L/PNLP-0512","10","Mejora funcional del servicio de salud pública en canarias.","2022-07-26","Cerrada","Ordinario","Aprobada","PROPOSICIONES NO DE LEY EN PLENO"
"10L/PNLP-0490","10","Apoyo a la ley del deporte nacional.","2022-06-10","Cerrada","Ordinario","Aprobada","PROPOSICIONES NO DE LEY EN PLENO"
"10L/PNLP-0495","10","Plan de recuperación de suelos y lucha contra la erosión.","2022-06-22","Cerrada","Ordinario","Aprobada","PROPOSICIONES NO DE LEY EN PLENO"
"10L/PNLP-0521","10","Correcta denominación de la profesión de enfermería.","2022-09-06","Cerrada","Ordinario","Aprobada","PROPOSICIONES NO DE LEY EN PLENO"
"10L/PNLP-0525","10","Muerte digna.","2022-09-16","Cerrada","Ordinario","Aprobada","PROPOSICIONES NO DE LEY EN PLENO"
"10L/PNLP-0526","10","Modificar los vocales del consejo escolar de canarias.","2022-09-16","Cerrada","Ordinario","Aprobada","PROPOSICIONES NO DE LEY EN PLENO"
"10L/PNLP-0502","10","Propuestas y acciones encaminadas a abordar el problema que afronta la sanidad pública en españa.","2022-07-06","Cerrada","Ordinario","Rechazada","PROPOSICIONES NO DE LEY EN PLENO"
"10L/PNLP-0522","10","Aplicación de una exención en canarias a la obligación del pago de la tasa correspondiente al permiso del sistema europeo de información y autorización de viajes (etias).","2022-09-07","Cerrada","Ordinario","Aprobada","PROPOSICIONES NO DE LEY EN PLENO"
"10L/PNLP-0527","10","Ayudas en educación para las familias.","2022-09-26","Cerrada","Ordinario","Rechazada","PROPOSICIONES NO DE LEY EN PLENO"
"10L/PNLP-0505","10","Actuaciones de regeneración del volcán de la palma.","2022-07-13","Cerrada","Ordinario","Aprobada","PROPOSICIONES NO DE LEY EN PLENO"
"10L/PNLP-0506","10","El plan rector de uso y gestión del parque nacional del teide.","2022-07-13","En tramitación","Ordinario","","PROPOSICIONES NO DE LEY EN PLENO"
"10L/PNLP-0507","10","Adopción de medidas para garantizar la estabilidad laboral del personal docente de religión en canarias.","2022-07-14","Cerrada","Ordinario","Rechazada","PROPOSICIONES NO DE LEY EN PLENO"
"10L/PNLP-0508","10","Problemática del cultivo de la papa.","2022-07-14","Cerrada","Ordinario","Aprobada","PROPOSICIONES NO DE LEY EN PLENO"
"10L/PNLP-0524","10","Modificación y actualización de los costes tipo del transporte en canarias, y cumplimiento del artículo 7 de nuestro régimen económico y fiscal.","2022-09-14","Cerrada","Ordinario","Aprobada","PROPOSICIONES NO DE LEY EN PLENO"
"10L/PNLP-0509","10","El tercer sector social.","2022-07-14","Cerrada","Ordinario","Aprobada","PROPOSICIONES NO DE LEY EN PLENO"
"10L/PNLP-0472","10","El día canario de las migraciones.","2022-05-12","Cerrada","Ordinario","Aprobada","PROPOSICIONES NO DE LEY EN PLENO"
"10L/PNLP-0473","10","Conectividad de las islas.","2022-05-12","Cerrada","Ordinario","Aprobada","PROPOSICIONES NO DE LEY EN PLENO"
"10L/PNLP-0474","10","Continuidad de la aplicación del tipo cero del igic a los materiales sanitarios básicos.","2022-05-12","En tramitación","Ordinario","","PROPOSICIONES NO DE LEY EN PLENO"
"10L/PNLP-0475","10","Incentivos fiscales para el segmento mice en el sector turístico.","2022-05-12","Cerrada","Ordinario","Aprobada","PROPOSICIONES NO DE LEY EN PLENO"
"10L/PNLP-0510","10","Puesta en marcha de un punto de atención continuada en el consultorio de mala y dotación de un profesional de enfermería para la actual ambulancia de soporte vital básico con base en arrieta.","2022-07-12","Cerrada","Ordinario","Aprobada","PROPOSICIONES NO DE LEY EN PLENO"
"10L/PNLP-0476","10","Localización y bajada al buque villa de pitanxo.","2022-05-13","Cerrada","Ordinario","Aprobada","PROPOSICIONES NO DE LEY EN PLENO"
"10L/PNLP-0479","10","Reforma de la constitución que elimine la referencia a nacionalidades y regiones en la constitución española.","2022-05-24","En tramitación","Ordinario","","PROPOSICIONES NO DE LEY EN PLENO"
"10L/PNLP-0466","10","Nutrición sostenible en los suelos agrarios.","2022-05-06","En tramitación","Ordinario","","PROPOSICIONES NO DE LEY EN PLENO"
"10L/PNLP-0467","10","Incremento de ratio de profesionales sanitarios por paciente.","2022-05-11","En tramitación","Ordinario","","PROPOSICIONES NO DE LEY EN PLENO"
"10L/PNLP-0468","10","Reducción del tipo impositivo de los productos sanitarios.","2022-05-11","En tramitación","Ordinario","","PROPOSICIONES NO DE LEY EN PLENO"
"10L/PNLP-0469","10","Reconocimiento a canarias del estatus de plena autonomía interna (pai) para la delimitación de los espacios marítimos.","2022-05-11","Cerrada","Ordinario","Rechazada","PROPOSICIONES NO DE LEY EN PLENO"
"10L/PNLP-0470","10","Creación del servicio de pesca recreativa y deportiva en la dirección general de pesca.","2022-05-11","Cerrada","Ordinario","Aprobada","PROPOSICIONES NO DE LEY EN PLENO"
"10L/PNLP-0517","10","El estado de los palmerales en la isla de fuerteventura.","2022-09-01","Cerrada","Ordinario","Aprobada","PROPOSICIONES NO DE LEY EN PLENO"
"10L/PNLP-0518","10","Defensa y mejora asistencia sanitaria privada y su contribución a la sostenibilidad del sistema nacional de salud.","2022-09-02","En tramitación","Ordinario","","PROPOSICIONES NO DE LEY EN PLENO"
"10L/PNLP-0519","10","Estabilización del personal de investigación en el sistema de ciencia, tecnología e innovación.","2022-09-02","En tramitación","Ordinario","","PROPOSICIONES NO DE LEY EN PLENO"
"10L/PNLP-0520","10","Revisión de las remuneraciones de los profesionales sanitarios del sistema nacional de salud y obligatoriedad de la realización de guardias.","2022-09-02","En tramitación","Ordinario","","PROPOSICIONES NO DE LEY EN PLENO"
"10L/PNLP-0471","10","Mejoras en el hospital del norte de tenerife.","2022-05-11","En tramitación","Ordinario","","PROPOSICIONES NO DE LEY EN PLENO"
"10L/PNLP-0478","10","Creación de unidad oncohematológica pediátrica en tenerife.","2022-05-23","Cerrada","Ordinario","Aprobada","PROPOSICIONES NO DE LEY EN PLENO"
"10L/PNLP-0480","10","El plan de naturalización de los centros educativos de canarias para la neutralidad de la huella de carbono.","2022-05-26","Cerrada","Ordinario","Aprobada","PROPOSICIONES NO DE LEY EN PLENO"
"10L/PNLP-0491","10","Vacunación contra la rabia de las mascotas procedentes de ucrania.","2022-06-16","En tramitación","Ordinario","","PROPOSICIONES NO DE LEY EN PLENO"
"10L/PNLP-0483","10","Implantación del programa canarias receta ejercicio físico.","2022-06-01","En tramitación","Ordinario","","PROPOSICIONES NO DE LEY EN PLENO"
"10L/PNLP-0492","10","Vigilancia de los suelos y limitación de los residuos.","2022-06-21","Cerrada","Ordinario","Aprobada","PROPOSICIONES NO DE LEY EN PLENO"
"10L/PNLP-0487","10","Cese del director general de pesca.","2022-06-09","En tramitación","Ordinario","","PROPOSICIONES NO DE LEY EN PLENO"
"10L/PNLP-0488","10","Mejora de la financiación de las cofradías de pescadores de canarias.","2022-06-09","En tramitación","Ordinario","","PROPOSICIONES NO DE LEY EN PLENO"
"10L/PNLP-0489","10","Estabilización docentes en canarias.","2022-06-09","Cerrada","Ordinario","Aprobada","PROPOSICIONES NO DE LEY EN PLENO"
"10L/PNLP-0493","10","Ampliación de plazas en el máster universitario en formación del profesorado.","2022-06-21","Cerrada","Ordinario","Aprobada","PROPOSICIONES NO DE LEY EN PLENO"
"10L/PNLP-0494","10","Plan plurianual de bajada generalizada de ratios en todas las etapas educativas no universitarias.","2022-06-21","Cerrada","Ordinario","Aprobada","PROPOSICIONES NO DE LEY EN PLENO"
"10L/PNLP-0477","10","Ciudades amigables con las personas mayores.","2022-05-20","Cerrada","Ordinario","Aprobada","PROPOSICIONES NO DE LEY EN PLENO"
"10L/PNLP-0498","10","Impulso y apoyo al sector aeronáutico y aeroespacial canario.","2022-06-29","Cerrada","Ordinario","Aprobada","PROPOSICIONES NO DE LEY EN PLENO"
"10L/PNLP-0499","10","La tragedia en la frontera de melilla con marruecos y la importancia de la política migratoria en el frontera sur de la unión europea.","2022-06-29","Cerrada","Ordinario","Aprobada","PROPOSICIONES NO DE LEY EN PLENO"
"10L/PNLP-0501","10","Regulación de la publicidad sanitaria.","2022-07-01","En tramitación","Ordinario","","PROPOSICIONES NO DE LEY EN PLENO"
"10L/PNLP-0500","10","Elaboración de currículos de contenidos claros, concisos y de alta calidad científica, libres de sesgo ideológico, para garantizar la igualdad de oportunidades del alumnado.","2022-06-29","En tramitación","Ordinario","","PROPOSICIONES NO DE LEY EN PLENO"
"10L/PNLP-0503","10","Dotación de dispositivos de geolocalización para personas mayores.","2022-07-07","Cerrada","Ordinario","Aprobada","PROPOSICIONES NO DE LEY EN PLENO"
"10L/PNLP-0496","10","Elaboración de un plan estratégico para la protección del viñedo en canarias.","2022-06-28","Cerrada","Ordinario","Aprobada","PROPOSICIONES NO DE LEY EN PLENO"
"10L/PNLP-0497","10","El despliegue de la policía autonómica canaria.","2022-06-28","Cerrada","Ordinario","Aprobada","PROPOSICIONES NO DE LEY EN PLENO"
"10L/PNLP-0504","10","Apoyo a la designación de gran canaria como sede del mundial de fútbol 2030.","2022-07-12","Cerrada","Ordinario","Aprobada","PROPOSICIONES NO DE LEY EN PLENO"
"10L/PNLP-0528","10","Modificación del decreto 85/2016, de 4 de julio, sobre la creación y regulación del fondo de desarrollo de canarias (fdcan).","2022-09-28","En tramitación","Ordinario","","PROPOSICIONES NO DE LEY EN PLENO"
"10L/PNLP-0513","10","Bonos gratuitos para uso recurrente de transporte público insular con las mismas condiciones que ofrece el estado al resto de ciudadanos de este país, del 1 de septiembre al 31 de diciembre de 2022.","2022-08-22","Cerrada","Ordinario","Rechazada","PROPOSICIONES NO DE LEY EN PLENO"
"10L/PNLP-0514","10","Garantizar la calidad asistencial a la ciudadanía y evitar el intrusismo laboral en las profesiones sanitarias.","2022-09-01","En tramitación","Ordinario","","PROPOSICIONES NO DE LEY EN PLENO"
"10L/PNLP-0529","10","Mejora de la atención a la salud mental en canarias.","2022-09-30","Cerrada","Ordinario","Aprobada","PROPOSICIONES NO DE LEY EN PLENO"
"10L/PNLP-0530","10","La salud mental infanto-juvenil.","2022-09-30","Cerrada","Ordinario","Aprobada","PROPOSICIONES NO DE LEY EN PLENO"
"10L/PNLP-0531","10","Eliminación de la obligatoriedad del uso de mascarillas en el transporte público.","2022-09-30","En tramitación","Ordinario","","PROPOSICIONES NO DE LEY EN PLENO"
"10L/PNLP-0523","10","Prevención, detección, diagnóstico y tratamiento de las enfermedades cardiovasculares.","2022-09-12","En tramitación","Ordinario","","PROPOSICIONES NO DE LEY EN PLENO"
"10L/PNLP-0511","10","Enfermeras de salud mental.","2022-07-22","En tramitación","Ordinario","","PROPOSICIONES NO DE LEY EN PLENO"
"10L/PNLP-0515","10","Elaboración de un plan de apoyo emocional para la población joven y adolescente a nivel regional propiciando la cooperación y coordinación de las diferentes administraciones públicas.","2022-09-01","Cerrada","Ordinario","Aprobada","PROPOSICIONES NO DE LEY EN PLENO"
"10L/PNLP-0516","10","Facilitar la renovación de certificados de vehículos especiales para el transporte terrestre de productos alimentarios a temperatura regulada en regiones extra peninsulares.","2022-09-01","Cerrada","Ordinario","Aprobada","PROPOSICIONES NO DE LEY EN PLENO"
"10L/PNLP-0484","10","Formación e información a empresas para la gestión telemática de los procesos de incapacidad temporal.","2022-06-03","En tramitación","Ordinario","","PROPOSICIONES NO DE LEY EN PLENO"
"10L/PNLP-0485","10","La mujer en el currículo.","2022-06-06","Cerrada","Ordinario","Aprobada","PROPOSICIONES NO DE LEY EN PLENO"
"10L/PNLP-0481","10","Creación de centros exclusivos para mujeres mayores de 65 años víctimas de violencia.","2022-06-01","En tramitación","Ordinario","","PROPOSICIONES NO DE LEY EN PLENO"
"10L/PNLP-0482","10","La reconstrucción y conexiones viarias de la palma.","2022-06-01","Cerrada","Ordinario","Aprobada","PROPOSICIONES NO DE LEY EN PLENO"
"10L/PNLP-0486","10","Desarrollo legislativo respecto a la ley 5/2018, de 14 de diciembre, de memoria histórica de canarias y de reconocimiento y reparación moral de las víctimas canarias de la guerra civil y la dictadura franquista y propuesta para el reconocimiento de las víctimas canarias del nazismo y del fascismo.","2022-06-07","Cerrada","Ordinario","Aprobada","PROPOSICIONES NO DE LEY EN PLENO"
"10L/PNLP-0547","10","El límite de la deducción por producciones audiovisuales en canarias.","2022-11-22","Cerrada","Ordinario","Aprobada","PROPOSICIONES NO DE LEY EN PLENO"
"10L/PNLP-0548","10","Implantación de estrategias de mejora de la seguridad del paciente con infecciones bucodentales.","2022-11-23","En tramitación","Ordinario","","PROPOSICIONES NO DE LEY EN PLENO"
"10L/PNLP-0549","10","La música en la salud.","2022-11-25","Cerrada","Ordinario","Aprobada","PROPOSICIONES NO DE LEY EN PLENO"
"10L/PNLP-0556","10","La declaración de interés insular del proyecto dreamland studios.","2022-12-15","Cerrada","Ordinario","Aprobada","PROPOSICIONES NO DE LEY EN PLENO"
"10L/PNLP-0541","10","Acciones y medidas para la igualdad de mujeres y hombres en el ámbito rural.","2022-10-27","Cerrada","Ordinario","Aprobada","PROPOSICIONES NO DE LEY EN PLENO"
"10L/PNLP-0542","10","Contribuir a la buena salud de nuestro sistema sanitario.","2022-10-27","Cerrada","Ordinario","Aprobada","PROPOSICIONES NO DE LEY EN PLENO"
"10L/PNLP-0543","10","La reducción de la brecha de género en la formación profesional industrial y tecnológica.","2022-10-27","Cerrada","Ordinario","Aprobada","PROPOSICIONES NO DE LEY EN PLENO"
"10L/PNLP-0544","10","Las medidas de atención, detección y reducción de la brecha en el diagnóstico del alumnado de altas capacidades intelectuales.","2022-11-03","En tramitación","Ordinario","","PROPOSICIONES NO DE LEY EN PLENO"
"10L/PNLP-0535","10","Los costes del suministro eléctrico de la producción de agua para el consumo humano.","2022-10-18","En tramitación","Ordinario","","PROPOSICIONES NO DE LEY EN PLENO"
"10L/PNLP-0536","10","Creación en las plantillas orgánicas de las instituciones sanitarias del servicio canario de la salud de la categoría estatutaria de enfermera/o especialista en enfermería de salud mental.","2022-10-19","En tramitación","Ordinario","","PROPOSICIONES NO DE LEY EN PLENO"
"10L/PNLP-0537","10","Análisis de las condiciones que determinan la fijación de indemnizaciones por residencia del personal en activo del sector público estatal en las islas canarias, y revisión y modificación de las cuantías de las mismas.","2022-10-20","En tramitación","Ordinario","","PROPOSICIONES NO DE LEY EN PLENO"
"10L/PNLP-0534","10","Formación en lenguaje de signos para facilitar la plena inclusión de las personas sordas.","2022-10-14","Cerrada","Ordinario","Aprobada","PROPOSICIONES NO DE LEY EN PLENO"
"10L/PNLP-0539","10","Continuidad de las ayudas al coste del combustible mientras persista elevado precio en las islas verdes.","2022-10-27","Cerrada","Ordinario","Rechazada","PROPOSICIONES NO DE LEY EN PLENO"
"10L/PNLP-0540","10","Medidas para trabajar en la recuperación y reconstrucción tras la erupción volcánica acaecida en cumbre vieja.","2022-10-27","Cerrada","Ordinario","Aprobada","PROPOSICIONES NO DE LEY EN PLENO"
